{
  "id": "62ebb978-fefc-40cb-8461-fd40053b4929",
  "session_id": "62ebb978-fefc-40cb-8461-fd40053b4929",
  "text": "Kicked off creating a brand-new living-workspace from the starter template. Following the repo's routing rules, the assistant read template/ and canon/operating-manual.md to learn the correct bootstrap procedure: copy template/ to a directory outside the repo, then fill in OVERVIEW.md through an interview before scaffolding any data, schemas, or tools. It surfaced that OVERVIEW.md must be completed first and asked the user for the workspace's purpose (which also determines the new directory name) as the opening interview question. The session ended there, waiting on the user's answer, so no workspace was actually copied or created yet.",
  "generated_at": "2026-07-10T21:58:27-06:00",
  "source_size": 63403,
  "source_last_active": "2026-07-08T21:51:03-06:00",
  "user_turns_at_gen": 5,
  "model": "claude-fable-5"
}
