{
  "id": "d71379fa-3cd9-43fb-b61d-d5ae85ffa706",
  "session_id": "d71379fa-3cd9-43fb-b61d-d5ae85ffa706",
  "text": "Opened a new research thread in the openreview systematic-review workspace with the request to review the latest advances in artificial retinas. Claude oriented itself per the repo's entry rules \u00e2\u20ac\u201d reading OVERVIEW.md and the skills (systematic-review, screening, extraction, evaluation, dashboard) \u00e2\u20ac\u201d and recognized the workspace already held one completed review (mouse genetics and mesothelioma) with the full protocol-to-PRISMA machinery. It moved to ask a scoping question (via AskUserQuestion) to define the new artificial-retinas review before starting, but the user interrupted that tool call. The session ended at the orientation stage with no protocol, search, or new review directory created.",
  "generated_at": "2026-07-10T21:58:40-06:00",
  "source_size": 124869,
  "source_last_active": "2026-07-08T21:48:41-06:00",
  "user_turns_at_gen": 14,
  "model": "claude-fable-5"
}
