{
  "id": "92f94519-9fdd-4609-a88f-8e4daf4a2b01",
  "session_id": "92f94519-9fdd-4609-a88f-8e4daf4a2b01",
  "text": "A conceptual conversation, not a coding session: the user asked Claude to characterize what kind of system the openreview/living-workspace repo actually is \u00e2\u20ac\u201d emphasizing that it is not a conventional installable application but a living, agent-operated workspace \u00e2\u20ac\u201d and then to situate that idea within current AI architectures and trends. Claude produced framing describing the repo as a durable, human-and-agent-shared workspace (data, schemas, tools, and views that an agent operates rather than a packaged app), and was explicitly cautioned not to overreach and to ask when unsure about how it relates to prevailing AI patterns. No files were edited or created; the output was explanatory positioning language about the living-workspace concept and its fit with agentic/AI-workspace trends.",
  "generated_at": "2026-07-10T21:58:20-06:00",
  "source_size": 36996,
  "source_last_active": "2026-07-09T21:12:19-06:00",
  "user_turns_at_gen": 4,
  "model": "claude-fable-5"
}
