{
  "id": "92bb0de1-4621-41a6-b577-0ac47ff8bef4",
  "session_id": "92bb0de1-4621-41a6-b577-0ac47ff8bef4",
  "text": "Reconstructed the history with broker Beth Gittleman (Compass / The Catalyst Team) around selling apartment 6G at 300 W 145th, searching Gmail to build a timeline that pinned the \"big disagreement\" to the March 25\u00e2\u20ac\u201c26 \"Timeline and Strategy\" thread (marketing/staging friction where Beth insisted price was the only lever) rather than a same-day email, which never surfaced in the index. Drafted a termination notice to Beth in the user's voice \u00e2\u20ac\u201d then rewrote it to anchor explicitly on the pre-offer marketing impasse and keep a gracious tone, without sending or creating anything. When the user flagged the legal angle, read the signed Co-Op Exclusive Right to Sell listing agreement (term 12/28/2025\u00e2\u20ac\u201c12/31/2026, ~6 months in) and confirmed his instinct: it is an exclusive right-to-sell with no early-termination clause, modifiable only by mutual written signed consent, with binding AAA arbitration and prevailing-party attorneys' fees. Bottom line reached: he cannot unilaterally terminate and any exit needs Compass's cooperation, so the letter should be framed as a decision made within that legal framework rather than a unilateral cancellation.",
  "generated_at": "2026-07-10T21:57:45-06:00",
  "source_size": 5993468,
  "source_last_active": "2026-07-05T20:05:43-06:00",
  "user_turns_at_gen": 29,
  "model": "claude-fable-5"
}
