{
  "id": "c526e19d-ff65-40cc-93e9-917055eb2d19",
  "session_id": "c526e19d-ff65-40cc-93e9-917055eb2d19",
  "text": "A learning-oriented walkthrough of CI/CD for the orch-studio repo, centered on how a push to `main` on GitHub could trigger an AWS production deployment. Claude explained GitHub Actions end to end \u00e2\u20ac\u201d how workflow YAML in `.github/workflows/` maps to runnable steps, the distinction between `run` (arbitrary shell commands on the runner) and `uses` (prebuilt actions as reusable building blocks), and sketched the \"protein\" of a real deploy workflow for the Orchestrator Studio site. The session then turned practical, setting up a simple proof-of-concept Actions workflow that emails the user on every push to main as a test, and ended by walking through what was needed to get that change committed and pushed to the remote.",
  "generated_at": "2026-07-10T21:58:13-06:00",
  "source_size": 161045,
  "source_last_active": "2026-07-05T10:25:40-06:00",
  "user_turns_at_gen": 19,
  "model": "claude-fable-5"
}
