{
  "id": "8ebd419d-1948-4645-9014-235a53eb1d6b",
  "session_id": "8ebd419d-1948-4645-9014-235a53eb1d6b",
  "text": "Audited a high-cost AWS environment to find teardown and optimization targets, then executed a careful decommission of the unused \"aftershoot\" application, monitored live via a botbeam dashboard (using the botbeam skill from the orchestra repo) that beamed task status as the plan ran. Deliberately preserved the aftershoot database and packaged an export of its prompt runs for Adam, formatted so he could browse the runs as if viewing them on the original website. Set up orchestratorstudios.ai alongside the existing .com: issued an ACM certificate, added four DNS records, and updated the CloudFront distribution so the site resolves on .ai with and without www, verifying all four hostnames end-to-end. Ended with the user authorizing one more careful cleanup.",
  "generated_at": "2026-07-10T21:57:54-06:00",
  "source_size": 5829556,
  "source_last_active": "2026-07-09T21:39:39-06:00",
  "user_turns_at_gen": 136,
  "model": "claude-fable-5"
}
