{
  "id": "20e01c7a-b517-4925-a773-1304ac135920",
  "session_id": "20e01c7a-b517-4925-a773-1304ac135920",
  "text": "A dogfooding/mechanics test of the openreview systematic-review pipeline (the \"HAPI path\"), run repeatedly against a deliberately tiny dataset to exercise the full flow end to end. The \"anger stored in fat cells\" study was deleted up front, and after some back-and-forth over whether to minimize data, the run settled on a small melatonin-for-jet-lag literature review as the throwaway test case; the study was created, run through protocol \u00e2\u2020\u2019 PubMed search \u00e2\u2020\u2019 dual-independent title/abstract and full-text screening \u00e2\u2020\u2019 extraction \u00e2\u2020\u2019 evaluation \u00e2\u2020\u2019 views/report, then deleted between iterations so core-engine changes could be re-tested cleanly. A realism note surfaced that only abstracts were retrievable for the older paywalled included studies, so full-text screening ran on abstracts by design. The session closed by producing a self-contained, copy-paste research request (question \"does oral melatonin reduce jet lag?\", slug melatonin-jet-lag, single PubMed query ~14 records, full PICO, inclusion/exclusion reasons, and per-arm extraction fields) for the user to hand to a fresh session to reproduce the exact minimal run.",
  "generated_at": "2026-07-10T21:57:53-06:00",
  "source_size": 761638,
  "source_last_active": "2026-07-08T14:19:27-06:00",
  "user_turns_at_gen": 95,
  "model": "claude-fable-5"
}
